{
  "schemaVersion": 1,
  "status": "OK",
  "startedUtc": "2026-03-22T23:36:14.4909366Z",
  "completedUtc": "2026-03-22T23:36:15.1560584Z",
  "bundleId": "bc8e726c-0b55-4b6e-af58-c84fa426a26a",
  "stages": [
    {
      "details": null,
      "name": "Load",
      "status": "SKIPPED",
      "completedUtc": "2026-03-22T23:36:14.4910325Z",
      "startedUtc": "2026-03-22T23:36:14.4910325Z"
    },
    {
      "details": null,
      "name": "Validate",
      "status": "SKIPPED",
      "completedUtc": "2026-03-22T23:36:14.4910325Z",
      "startedUtc": "2026-03-22T23:36:14.4910325Z"
    },
    {
      "details": null,
      "name": "Transform",
      "status": "SKIPPED",
      "completedUtc": "2026-03-22T23:36:14.4910325Z",
      "startedUtc": "2026-03-22T23:36:14.4910325Z"
    },
    {
      "details": null,
      "name": "Render",
      "status": "SKIPPED",
      "completedUtc": "2026-03-22T23:36:14.4910325Z",
      "startedUtc": "2026-03-22T23:36:14.4910325Z"
    },
    {
      "details": null,
      "name": "Finalize",
      "status": "SKIPPED",
      "completedUtc": "2026-03-22T23:36:14.4910325Z",
      "startedUtc": "2026-03-22T23:36:14.4910325Z"
    }
  ],
  "issues": [],
  "matches": [
    {
      "dataset": "datasets/Lenovo.DE/collector-out/de-prod-01/target_de-prod-01/systems.json",
      "selector": "items.0.id",
      "valuePreview": "1",
      "tag": "DE_SYSTEM_ID"
    },
    {
      "dataset": "datasets/Lenovo.DE/collector-out/de-prod-01/target_de-prod-01/systems.json",
      "selector": "items.0.name",
      "valuePreview": "DE4200_Rack4",
      "tag": "DE_SYSTEM_NAME"
    },
    {
      "dataset": "datasets/Lenovo.DE/collector-out/de-prod-01/target_de-prod-01/systems.json",
      "selector": "items.0.model",
      "valuePreview": "DE4200",
      "tag": "DE_SYSTEM_MODEL"
    },
    {
      "dataset": "datasets/Lenovo.DE/collector-out/de-prod-01/target_de-prod-01/systems.json",
      "selector": "items.0.status",
      "valuePreview": "optimal",
      "tag": "DE_SYSTEM_STATUS"
    },
    {
      "dataset": "datasets/Lenovo.DE/collector-out/de-prod-01/target_de-prod-01/systems.json",
      "selector": "items.0.fwVersion",
      "valuePreview": "08.90.09.00",
      "tag": "DE_FIRMWARE_VERSION"
    },
    {
      "dataset": "datasets/Lenovo.DE/collector-out/de-prod-01/target_de-prod-01/systems.json",
      "selector": "items.0.appVersion",
      "valuePreview": "08.90.09.00",
      "tag": "DE_APP_VERSION"
    },
    {
      "dataset": "datasets/Lenovo.DE/collector-out/de-prod-01/target_de-prod-01/systems.json",
      "selector": "items.0.bootVersion",
      "valuePreview": "08.90.09.00",
      "tag": "DE_BOOT_VERSION"
    },
    {
      "dataset": "datasets/Lenovo.DE/collector-out/de-prod-01/target_de-prod-01/systems.json",
      "selector": "items.0.nvsramVersion",
      "valuePreview": "N4000-890870-D03",
      "tag": "DE_NVSRAM_VERSION"
    },
    {
      "dataset": "datasets/Lenovo.DE/collector-out/de-prod-01/target_de-prod-01/systems.json",
      "selector": "items.0.ip2",
      "valuePreview": "192.0.2.12",
      "tag": "DE_MANAGEMENT_IP"
    },
    {
      "dataset": "datasets/Lenovo.DE/collector-out/de-prod-01/target_de-prod-01/systems.json",
      "selector": "items.0.driveCount",
      "valuePreview": "24",
      "tag": "DE_DRIVE_COUNT"
    },
    {
      "dataset": "datasets/Lenovo.DE/collector-out/de-prod-01/target_de-prod-01/system_1_DE4200_Rack4/storage-containers.json",
      "selector": "item_count",
      "valuePreview": "3",
      "tag": "DE_CONTAINER_COUNT"
    },
    {
      "dataset": "datasets/Lenovo.DE/collector-out/de-prod-01/target_de-prod-01/system_1_DE4200_Rack4/volumes.json",
      "selector": "item_count",
      "valuePreview": "3",
      "tag": "DE_VOLUME_COUNT"
    },
    {
      "dataset": "datasets/Lenovo.DE/collector-out/de-prod-01/target_de-prod-01/run_summary.json",
      "selector": "collectedUtc",
      "valuePreview": "03/23/2026 09:02:08",
      "tag": "DE_COLLECTION_COLLECTED_UTC"
    },
    {
      "dataset": "datasets/Lenovo.DE/collector-out/de-prod-01/target_de-prod-01/run_summary.json",
      "selector": "mode",
      "valuePreview": "Cli",
      "tag": "DE_COLLECTION_MODE"
    },
    {
      "dataset": "datasets/Lenovo.DE/collector-out/de-prod-01/target_de-prod-01/run_summary.json",
      "selector": "controller",
      "valuePreview": "10.240.59.179",
      "tag": "DE_COLLECTION_CONTROLLER"
    },
    {
      "dataset": "datasets/Lenovo.DE/collector-out/de-prod-01/target_de-prod-01/run_summary.json",
      "selector": "port",
      "valuePreview": "8443",
      "tag": "DE_COLLECTION_PORT"
    },
    {
      "dataset": "datasets/Lenovo.DE/collector-out/de-prod-01/target_de-prod-01/run_summary.json",
      "selector": "systemCount",
      "valuePreview": "1",
      "tag": "DE_COLLECTION_SYSTEM_COUNT"
    },
    {
      "dataset": "datasets/Lenovo.DE/collector-out/de-prod-01/target_de-prod-01/systems.json",
      "selector": "items",
      "valuePreview": "\r\nname         model  status  fwVersion   appVersion  bootVersion nvsramVersion ...",
      "tag": "DE_SYSTEMS_TABLE_JSON"
    },
    {
      "dataset": "datasets/Lenovo.DE/collector-out/de-prod-01/target_de-prod-01/system_1_DE4200_Rack4/drives.json",
      "selector": "items",
      "valuePreview": "\r\nSlot Media Type Raw     Usable  Firmware Status  SerialNumber\r\n---- ----------...",
      "tag": "DE_DRIVES_TABLE_JSON"
    },
    {
      "dataset": "datasets/Lenovo.DE/collector-out/de-prod-01/target_de-prod-01/system_1_DE4200_Rack4/storage-containers.json",
      "selector": "items",
      "valuePreview": "\r\nName       ContainerType RaidLevel DriveMediaType Total    Used     Free      ...",
      "tag": "DE_STORAGE_CONTAINERS_TABLE_JSON"
    },
    {
      "dataset": "datasets/Lenovo.DE/collector-out/de-prod-01/target_de-prod-01/system_1_DE4200_Rack4/volumes.json",
      "selector": "items",
      "valuePreview": "\r\nName          Size     Status  RaidLevel Container\r\n----          ----     ---...",
      "tag": "DE_VOLUMES_TABLE_JSON"
    },
    {
      "dataset": "datasets/Lenovo.DE/collector-out/de-prod-01/target_de-prod-01/system_1_DE4200_Rack4/system-controllers.json",
      "selector": "items",
      "valuePreview": "\r\nController Slot Status  AppVersion  BootVersion SerialNumber\r\n---------- ---- ...",
      "tag": "DE_CONTROLLERS_TABLE_JSON"
    },
    {
      "dataset": "datasets/Lenovo.DE/collector-out/de-prod-01/target_de-prod-01/system_1_DE4200_Rack4/trays.json",
      "selector": "items",
      "valuePreview": "\r\ntrayType trayRole        controllerModelName status serialNumber partNumber ve...",
      "tag": "DE_TRAYS_TABLE_JSON"
    },
    {
      "dataset": "datasets/Lenovo.DE/collector-out/de-prod-01/target_de-prod-01/system_1_DE4200_Rack4/transport.json",
      "selector": "items.0.systemId",
      "valuePreview": "1",
      "tag": "DE_TRANSPORT_SYSTEM_ID"
    },
    {
      "dataset": "datasets/Lenovo.DE/collector-out/de-prod-01/target_de-prod-01/system_1_DE4200_Rack4/transport.json",
      "selector": "items.0.activeTransport",
      "valuePreview": "iscsi",
      "tag": "DE_TRANSPORT_ACTIVE"
    },
    {
      "dataset": "datasets/Lenovo.DE/collector-out/de-prod-01/target_de-prod-01/system_1_DE4200_Rack4/transport.json",
      "selector": "items.0.iscsiIqn",
      "valuePreview": "iqn.2002-09.com.lenovo:thinksystem.6d039ea000d9f018000000006949701c",
      "tag": "DE_TRANSPORT_ISCSI_IQN"
    },
    {
      "dataset": "datasets/Lenovo.DE/collector-out/de-prod-01/target_de-prod-01/system_1_DE4200_Rack4/management-interfaces.json",
      "selector": "items.0.controllerLabel",
      "valuePreview": "B",
      "tag": "DE_MGMT_1_CONTROLLER_LABEL"
    },
    {
      "dataset": "datasets/Lenovo.DE/collector-out/de-prod-01/target_de-prod-01/system_1_DE4200_Rack4/management-interfaces.json",
      "selector": "items.0.controllerSlot",
      "valuePreview": "2",
      "tag": "DE_MGMT_1_CONTROLLER_SLOT"
    },
    {
      "dataset": "datasets/Lenovo.DE/collector-out/de-prod-01/target_de-prod-01/system_1_DE4200_Rack4/management-interfaces.json",
      "selector": "items.0.portLabel",
      "valuePreview": "P1",
      "tag": "DE_MGMT_1_PORT_LABEL"
    },
    {
      "dataset": "datasets/Lenovo.DE/collector-out/de-prod-01/target_de-prod-01/system_1_DE4200_Rack4/management-interfaces.json",
      "selector": "items.0.interfaceName",
      "valuePreview": "wan0",
      "tag": "DE_MGMT_1_INTERFACE_NAME"
    },
    {
      "dataset": "datasets/Lenovo.DE/collector-out/de-prod-01/target_de-prod-01/system_1_DE4200_Rack4/management-interfaces.json",
      "selector": "items.0.linkStatus",
      "valuePreview": "up",
      "tag": "DE_MGMT_1_LINK_STATUS"
    },
    {
      "dataset": "datasets/Lenovo.DE/collector-out/de-prod-01/target_de-prod-01/system_1_DE4200_Rack4/management-interfaces.json",
      "selector": "items.0.ipv4Address",
      "valuePreview": "10.240.59.179",
      "tag": "DE_MGMT_1_IPV4_ADDRESS"
    },
    {
      "dataset": "datasets/Lenovo.DE/collector-out/de-prod-01/target_de-prod-01/system_1_DE4200_Rack4/management-interfaces.json",
      "selector": "items.0.ipv4SubnetMask",
      "valuePreview": "255.255.252.0",
      "tag": "DE_MGMT_1_IPV4_SUBNET_MASK"
    },
    {
      "dataset": "datasets/Lenovo.DE/collector-out/de-prod-01/target_de-prod-01/system_1_DE4200_Rack4/management-interfaces.json",
      "selector": "items.1.controllerLabel",
      "valuePreview": "A",
      "tag": "DE_MGMT_2_CONTROLLER_LABEL"
    },
    {
      "dataset": "datasets/Lenovo.DE/collector-out/de-prod-01/target_de-prod-01/system_1_DE4200_Rack4/management-interfaces.json",
      "selector": "items.1.controllerSlot",
      "valuePreview": "1",
      "tag": "DE_MGMT_2_CONTROLLER_SLOT"
    },
    {
      "dataset": "datasets/Lenovo.DE/collector-out/de-prod-01/target_de-prod-01/system_1_DE4200_Rack4/management-interfaces.json",
      "selector": "items.1.portLabel",
      "valuePreview": "P1",